corpusid|source|context|senseid
840355264|que_pasa|Algunos informes periodísticos, basados en los archivos descubiertos en Paraguay, hablan de una carta escrita por el general (r) Manuel Contreras a el general paraguayo Guanes Serrano, en la que ofrece el cuartel de la DINA como cuartel general de la operación, para así 'centralizar la información sobre los antecedentes de personas, organizaciones y otras actividades conectadas directa o indirectamente con la subversión'.|LETTER_00
840357771|que_pasa|Por eso, esta semana, varios senadores enviaron cartas a sus colegas de derecha para notificar les que si no concurrían a votar proyectos de ley, ellos no se abstendrían de hacerlo, porque el acuerdo no rige para ausencias por protestas políticas.|LETTER_00
840359983|que_pasa|La fórmula de los propietarios (Rebeca Iver y su hijo, Felipe Castillo, que además maneja el excelente restaurante 'Doña Paula', en el interior de Viña Santa Rita), y que en general comparte la gente que sabe comer, es cambiar de platos muy de tarde en tarde y mantener una calidad constante, una carta estable, una cocina que no va a deparar sorpresas ni sobresaltos a el público exigente y, en general, conservador que allí concurre.|MENU_00
840360321|que_pasa|La repostería de 'Carrousel' ostenta ya una impronta netamente francesa en la muy buena calidad de sus Crepes Suzette o la Mousse Orleans de castaña, en una reiteración de carta precisa, pero impecablemente realizada.|MENU_00
840362808|que_pasa|Mama Fresia había puesto en la maleta sus botas más firmes, así como sus cuadernos y el atado de cartas de amor de Joaquín Andieta.|LETTER_00
840385975|que_pasa|Horas antes de que las 3.500 páginas fueran entregadas a la luz pública, se jugaron su última carta.|CARD_00
840393292|que_pasa|Los síntomas de el cambio ya son observables en Estados Unidos, donde el tráfico de datos a través de Internet sobrepasa las llamadas telefónicas y el correo electrónico ya supera a el envío de cartas tradicionales.|LETTER_00
835717997|que_pasa|Desde su inauguración en 1914, la cadena de restaurantes incluye en su carta el té en hojas con toda la implementación necesaria.|MENU_00
840518035|que_pasa|Desde la inauguración de la carta de vinos y de su servicio por copas, ofrece también de lunes a sábado, en este orden, una especialidad por día como plato fuerte (5.500), ya sea Pollo de campo, Cochinillo, Mariscos, Cordero patagónico, Salmón y Carne de caza.|MENU_00
810316013|primera_linea|A el momento de barajar el naipe, las cartas posibles para marcar el nuevo juego son una revitalización de la agenda valórica progresista, reimpulsar la reforma a la salud -que en el ámbito técnico ha desentrabado los escollos para una autoridad sanitaria- o revivir las enmiendas pendientes a el financiamiento de la educación superior.|CARD_00
810350928|primera_linea|Jesse Jackson recibe carta de el Talibán pero declina mediar.|LETTER_00
810350995|primera_linea|La carta 'no aumenta mi inclinación a ir', dijo, después de informar que reenvió la misiva a el secretario de Estado Colin Powell.|LETTER_00
810351026|primera_linea|Firmada por el mulá Abdul Salam Zaeef, la carta reza 'En la actual situación crítica, se necesitan más prudencia, sagacidad y paciencia para resolver las cuestiones entre Afganistán y Estados Unidos a través de medios pacíficos, y apreciamos su mediación con altos funcionarios gubernamentales de Afganistán'.|LETTER_00