corpusid|source|context|senseid
278704965|chile_tech|Los educadores, los profesionales y las pequeñas empresas deben producir materiales colaterales de calidad profesional, desde folletos, cartas, y reportes en tiempo limitado, con un escaso presupuesto y sin experiencia en diseño.|LETTER_00
280068127|chile_tech|Los usuarios pueden jugar, comunicarse y conectarse en línea para juegos interactivos de cartas, tableros, fichas y otros|CARD_00.
278736013|chile_tech|Según la carta de intenciones, firmada en diciembre de 2000, las tres empresas compartirán sus recursos para prestar servicios de gestión de viajes a más de dos millones de clientes.|LETTER_00
278863520|chile_tech|Las tres compañías orientadas a la aeronavegación mundial anunciaron la firma de una carta de intención para desarrollar una iniciativa empresarial global para proveer comunicaciones de banda ancha y servicio de información digital para la aviación comercial.|LETTER_00
278913717|chile_tech|En febrero de el presente año, CasaChile.cl publicó una carta de un lector de Australia que solicitaba ayuda para ubicar a un hermano.|LETTER_00
278931387|chile_tech|Tras la situación, Network Solutions bloqueó la petición de el dominio, enviando una carta a Chile Networks, en la cual informaba haber acogido la petición de Chilenet de detener el uso de los dominios, restandoles 37 días para apelar.|LETTER_00
278955422|chile_tech|Como un paso fundamental en el compromiso de Cisco Systems con la educación de Chile, el Presidente y CEO de la compañía John Chambers y el Presidente de la República de Chile, Ricardo Lagos, firmaron una carta de compromiso a través de la cual Cisco entregará un grupo de herramientas para facilitar la formación y el perfeccionamiento de los profesores chilenos.|LETTER_00
278955447|chile_tech|La carta considera la donación, a través de el Cisco Learning Institute (CLI), de una solución de e.Learning (aprendizaje en red) basada en la Web, que permite la creación de cursos y entrega herramientas de administración para un ambiente personalizado de e.Learning para la disponibilidad de contenidos y la evaluación de sus usuarios.|LETTER_00
278955612|chile_tech|La firma de esta carta foma parte de un constante compromiso de Cisco Systems con la educación, tanto a nivel global, como en Chile.|LETTER_00
279189100|chile_tech|El sistema de código de barra, bajo el concepto de módulos automatizados, permite un control de inventario fidedigno de la trayectoria que siguió la carta desde que se despachó hasta que llegó a destino.|LETTER_00
279189129|chile_tech|Es decir, tanto Envíos, como el cliente, pueden realizar la búsqueda y seguimiento de las cartas en cualquier momento de su recorrido.|LETTER_00
427214016|la_cuarta|La rubia tarotista, que ahora lee las cartas en el programa de Ivette Vergara, debutó en pantalla como la sirena de 'Corazón Partío' (TVN).|CARD_00
427214159|la_cuarta|Hace dos años se casó con un suertudo chileno que no tiene nada que ver con el mundo esotérico. 'Él es sumamente terrestre, pero le tiene mucho respeto a esto', cuenta mientras baraja las cartas en una mesita de su local.|CARD_00
427257926|la_cuarta|la cuarta: El mago tenía una carta bajo la manga|CARD_00
427257948|la_cuarta|El mago tenía una carta bajo la manga|CARD_00
427306563|la_cuarta|Dicha labor recaerá en el Ministerio de Relaciones Exteriores, donde ya se halla la carta rogatoria para su tramitación, 'a fin de que se sirva ordenar las diligencias diplomáticas que sean necesarias', indica el fallo de la Suprema.|LETTER_00
427307697|la_cuarta|Según estas fuentes, el informe sólo sería un recurso inventado por el ex detective para entrar a el negocio de el soplonaje a alto nivel, y ocupar el vacío que dejó en este mercado la dupla formada por Lenin Guardia y Humberto López Candia, que quedaron fuera de combate tras ser encanados por el caso de las cartas bombas.|LETTER_00
427307991|la_cuarta|En el lugar Liliana dejó una carta dirigida a sus hijos.|LETTER_00
427318190|la_cuarta|Caballero tuvo el mejor taco como si le hubiesen dado un taco de manos de Thalía quedó el volante argentino nacionalizado mexicano Gabriel Caballero, quien dijo sentirse en las nubes por su convocatoria para formar parte de la selección cuate, que irá a charrasquear a el Mundial asiático. 'Es un sueño caro; me disponía a ver el Mundial por tele y de repente llegó la convocatoria', dijo Caballero, jugador de los Tuzos de el Pachuca y que en diciembre pasado recibió su carta de ciudadanía azteca.|LETTER_00
427323868|la_cuarta|Lorena Osorio, de 23 años, quien tiene discapacidad física, no pudo aguantar las lágrimas cuando recibió el premio especial a la superación por haberse trasladado desde Requínoa, en la Sexta Región, a Santiago para asistir a el curso. 'Por una carta nos enteramos que existía la fundación y mi hermana que vive en Santiago me recibió en su casa. Ahora estoy feliz por todo lo que he aprendido, pero me hace falta encontrar pega, porque para eso uno se capacita', dijo junto a su querida hermana.|LETTER_00
427331282|la_cuarta|Informe de Contraloría afecta orden público de la nación', reza apocalíptica carta de galenos.|LETTER_00
427331618|la_cuarta|El informe ha servido para armar un escándalo público con grave perjuicio para el país y que por cierto afecta el orden público de la nación, a el amenazar la destrucción de la cohesión interna de el sistema de salud estatal', dice la carta colorienta.|LETTER_00
427343189|la_cuarta|Correos entregó cartas y estelas a ladrillos de ex Peni y también a pelados de el Buin.|LETTER_00
427343227|la_cuarta|Los pelados de el Regimiento Buin aprovecharon de escribir y enviar altiro las cartas a sus progenitoras.|LETTER_00
415118538|la_cuarta|La movida fue en las categorías magia de cerca (juegos con cartas, monedas y artículos pequeños) y de salón o escenario (trucos mentales, ilusionismo y escapismo).|CARD_00
415409167|la_cuarta|Por un error, asimilamos a el rol a 'Magic' y a otros juegos con cartas que sería 'como comparar los juegos de salón con el caballito de bronce', dicen los roleros.|CARD_00
424268414|la_cuarta|Por ejemplo, un juego de cartas o de otro tipo donde siempre exista un ganador y un perdedor.|CARD_00
515594379|el_mercurio|La carta demuestra vigencia, coherencia en la elección de las etiquetas y ofertas para todos los gustos.|LETTER_00
515594405|el_mercurio|El año pasado fue elegida como la mejor carta de vinos de Santiago, por la 'Guía de vinos de Chile' (editada por Paula Comunicaciones).|MENU_00
515594930|el_mercurio|En la categoría 'Mejor carta de vinos' hubo dos personas se abstuvieron.|MENU_00
515596029|el_mercurio|De la carta donde ningún plato de pescado está originalmente concebido para tintos, advierte sugiere indagar en las combinaciones entre el kimiday con salsa de crema y ostiones (6.500) junto a un pinot noir reserva, pues la barrica le aporta la mantequilla necesaria; o la sabrosa tilapia a la oliva (6.300) con malbec, ya que los dos últimos van muy bien.|MENU_00
515596311|el_mercurio|Incluso, ya han llegado a las cartas de los restaurantes de mantel largo con altas dosis de creatividad y sofisticación.|MENU_00
515599184|el_mercurio|Aunque el grueso de la carta se centra en la parrilla, y dentro de ésta en los cortes de vacuno, se ofrecen también en esa forma embutidos, interiores, cordero, cerdo, pollo y pescados, y además unas pocas entradas. innecesarias dado el tamaño de las porciones una decena de platos cocinados con pastas, pescados y por cierto carnes y varias ensaladas.|MENU_00
515600079|el_mercurio|El actual chef, Cristián Rebolledo, ofrece una carta claramente inspirada en esa cocina, pero con aportes personales interesantes.|MENU_00
515601757|el_mercurio|El público tiene dos opciones: el menú didáctico (2.900), que es el que elaboran los alumnos de último año, y los platos de la carta.|MENU_00
515601818|el_mercurio|A la carta hay seis variedades de carnes (como lomo vetado, 2.800 o pechuga de pollo deshuesada, 2.800), cuatro alternativas de pescados (como salmón en salsa de camarones, 3.900 o trucha arlequín, 4.500 ) y fetuccini a la marinera (3.600) o Alfredo (2.600).|MENU_00
515602697|el_mercurio|La carta ofrece numerosos mariscos y carnes, con variadas salsas y algunas especialidades de estilo cajoun; y los postres, todos hechos en casa incluidos los helados, se presentan en un gran naipe cuyas cartas llevan las respectivas fotografías.|MENU_00
515603090|el_mercurio|A un costado de el Mercado de Providencia nos topamos con este minimalista restaurante que tras su sicodélica entrada nos invita a disfrutar de una decoración moderna, pero acogedora, música electrónica y una contundente carta que combina sabores, especies y aliños a la perfección.|MENU_00
515603389|el_mercurio|Se puede empezar desde las 8:00 AM (incluso domingos) con un buen café y un crujiente croissant hecho en casa, para continuar a lo largo de el día con la inédita y sorprendente selección de sabores de la carta, en cuya preparación se ha cuidado hasta el último detalle.|MENU_00
515603848|el_mercurio|Pero su mayor gracia está en la carta: aquí se ofrecen pescados chilenos que no se encuentran fácilmente, como el rollizo, la cojinova, la palometa, el vilagai y vieja.|MENU_00
515604227|el_mercurio|Este restaurante, ubicado en Vitacura y que se inauguró tan sólo hace tres meses, sorprende por la variedad de platos que su carta contempla.|MENU_00
515604260|el_mercurio|Con una carta extravagante, en la que se encuentran distintos sabores, como por ejemplo, sushi con fruta, envueltos en queso crema, fritos, calientes y enteros, este local hace notar la diferencia.|MENU_00
537395192|el_mercurio|¿Llegarán otros juegos? ­pregunta ansioso en la tienda Warner, un gringo de dos metros que ya ha comprado cartas, una lámpara, dos camisetas, una manta, varios cuadernos y, por supuesto, la edición completa de las aventuras de el mago con anteojos.|CARD_00
531294538|el_mercurio|La fiesta de el Nacional, además, considera la inauguración de el Museo de Mitos y Leyendas, con la historia, principales hitos y datos técnicos de el único juego de cartas de estrategia chileno.|CARD_00
582693602|la_segunda|Según el relato que está en manos de la SVS, en la carta fechada el 15 de noviembre, AES cuestiona que si los ADR no emiten una posición sobre los temas a tratar en la junta la aprobación de la alianza, propuesta por TotalFinaElf será el presidente de el directorio quien deberá decidir por ellos.|LETTER_00
582696851|la_segunda|El coronel Gran López agrega que para ello habría que traducir los textos pero no se hace necesario cambiar las cartas que aparecen reseñadas ya que están a modo de ejemplo y se han construido usando normas internacionales.|LETTER_00
582722512|la_segunda|También todas deben tener papelería, y entre mandar una carta fea u otra bien diseñada.|LETTER_00
582739130|la_segunda|En enero de 2000, los abogados Patricio Ossa y Guillermo Hevia enviaron una carta circular a todos los accionistas de Campos Chilenos.|LETTER_00
582739226|la_segunda|Curiosamente, y esto lo pudo comprobar la investigación que realizó el Colegio de Abogados, en la cual se hizo parte el ejecutivo de Pathfinder Félix Bacigalupo, pocos días antes de el envío de dicha carta se había montado en la red de internet una página web denominada 'accionistascamposvirtualeave.net' que luego tomó el nombre de 'defiendeteonline.com'.|LETTER_00
582739546|la_segunda|En este asunto lo que se ha dicho es que hay una intención de incitar a el litigio en circunstancias de que yo ya era parte de un litigio contra Félix Bacigalupo en la Superintendencia de Valores y Seguros y había otros dos juicios iniciados en tramitación. Esto se contrapone a lo que dice el fallo en que pareciera que a raíz de mis cartas se hubieran iniciado los juicios. Eso no es efectivo', explica Ossa.|LETTER_00
582777555|la_segunda|En este sentido, informó que le enviaron dos cartas a Longueira, sin recibir ningún tipo de respuesta.|LETTER_00
582778125|la_segunda|En la oportunidad se entregará una carta dirigida a el intendente Jaime Tohá y a el Presidente de la República, argumentando la necesidad de que se apliquen las sobretasas.|LETTER_00
582788080|la_segunda|IVAX envió una carta a Laboratorios Chile comunicandole que aprobaba el due diligence que realizó sobre la empresa y sus filiales, con lo cual se ratifica que sigue adelante la operación en los términos y precios acordados.|LETTER_00
582790441|la_segunda|Enviaron carta de intenciones a el organismo.|LETTER_00
582790504|la_segunda|Una carta de intenciones le envió el Gobierno brasilero el pasado 14 de junio, por intermedio de el ministro de Finanzas, Pedro Malán, y el presidente de el Banco Central, Arminio Fraga, a el presidente de el Fondo Monetario Internacional Horst Köhler, dando le detalles de las políticas que Brasil pretende implementar en el contexto de su solictud de ayuda a el FMI.|LETTER_00
582790743|la_segunda|Esta carta sigue a otra, fechada el pasado 5 de junio, en que los mismos dos personeros dan a conocer un balance de la situación económica brasileña y de las políticas que se han seguido, claro que dado el escenario que ha enfrentado esta semana Brasil, queda un poco desfasado.|LETTER_00
582798729|la_segunda|Vinos... y una buena carta.|MENU_00
582798945|la_segunda|Claro que para estos negocios por el momento no hay nada nuevo en la carta... por ahora el menú sólo incluye explotar a el máximo los negocios inmobiliario y vitivinícola, que es donde concentran su know how.|MENU_00
558633651|la_segunda|Más de una vez lo hemos dicho: la renovación de la carta en un antiguo restaurante acreditado suele traer más aportes que la inauguración de un local aventurero.|MENU_00
561583478|la_segunda|La carta fue enviada supuestamente por Marcos a un cantante, Angel Luis Lara, alias 'El Ruso', con motivo de la inauguración de un local prozapatista en Madrid, Aguascalientes.|LETTER_00
561913925|la_segunda|A el almuerzo, la primera carta se reemplaza por un menú ejecutivo (3.500).|MENU_00
562052438|la_segunda|Son muchas las cartas que reciben diariamente, como si el público supiera que (a algunos de ellos) esos 15 minutos de fama les cambiaría la vida.|LETTER_00
563595226|la_segunda|Todo casi perfecto, si no fuera porque en un local de esta categoría no es posible aceptar una carta con tantos errores de ortografía.|MENU_00
563565791|la_segunda|Qué hacer: Aprende un refrán, un trabalenguas o un truco con cartas.|CARD_00	
563569162|la_segunda|En eso tuvimos un acierto importante que fue el jugar nos una carta con Vanessa Miller como Bárbara.|CARD_00
433260963|lun|Si el retoño comienza a reclamar por el juego de cartas intercambiables, deben tener se a mano, para empezar, 10.500 pesos.|CARD_00
433260554|lun|Los juegos de cartas son una de las novedades para los regalones.|CARD_00
433260436|lun|El señor de los anillos, en tanto, con sus hobbits, elfos, enanos y humanos, ya tiene en tiendas una colección de figuras de acción, cartas coleccionables y juegos de estrategia, en lo que se supone sólo es el comienzo de la arremetida.|CARD_00
442976051|lun|Con ese juego de cartas, sólo faltará Jorge Hevia para tener el póker completo.|CARD_00
446648204|lun|Se inauguró la nueva tienda Salo, donde se pueden encontrar desde juegos de estrategia como 'Mitos y leyendas', las cartas de 'El señor de los anillos', hasta álbumes descontinuados.|CARD_00
456988057|lun|Pero el juego requiere, en otros niveles, mazos de 60 cartas, por lo que hay que comprar sobres adicionales.|CARD_00
52904639 |la_tercera|Esta contenía 60 cartas de personalidades destacadas y detalles sobre la vida en esa ciudad en el año 1901.|LETTER_00
652904955|la_tercera|En su interior se encontraron cerca de 100 cartas, decenas de fotografías y gran cantidad de recuerdos de la época, que en el futuro serán exhibidos en la Biblioteca de el Tutt College.|LETTER_00
652904981|la_tercera|Entre las cartas recuperadas existe, incluso, una de el entonces vicepresidente de Estados Unidos Theodore Roosevelt, que sólo semanas después de escribir la misiva, tuvo que asumir la presidencia de ese país tras el asesinato de el entonces mandatario William McKinley.|LETTER_00
652905166|la_tercera|Además, hay una carta de el entonces presidente de la YWCA, la asociación cristiana de jóvenes, para quien ocupara su lugar el 2001.|LETTER_00
652905215|la_tercera|Esto, porque varias cartas no se encuentran en muy buen estado y serán traspasadas a microfichas por los funcionarios de la biblioteca de la Universidad.|LETTER_00
652923447|la_tercera|Paulatinamente ha ido desapareciendo la costumbre de comunicarse a través de una simple carta.|LETTER_00
652923481|la_tercera|Ya casi nadie manda cartas de tipo personal para comunicar se a distancia.|LETTER_00
652923536|la_tercera|El sociólogo Carlos Catalán señala que quienes cuentan con internet dejaron definitivamente de enviar cartas a través de el correo tradicional.|LETTER_00
652923588|la_tercera|Es un sistema donde se deja de lado la formalidad de las cartas, se utiliza un lenguaje mucho más coloquial y, por lo tanto, la comunicación se hace más fluida y flexible. 'Esto se traduce en una mayor cercanía entre las personas que se están comunicando', explica Catalán.|LETTER_00
652923730|la_tercera|Por su parte, el sociólogo Eduardo Rodríguez, de Feedback Comunicaciones, opina que si bien el e.mail permite tener una comunicación más rápida y, a veces, casi instantánea, es mucho más fría e impersonal. 'Cuando las cartas están escritas a mano y son firmadas por el remitente todo se hace más cercano para el destinatario', dice.|LETTER_00
652923993|la_tercera|Posiblemente, durante la Navidad que recién pasó, gran parte de los chilenos y casi con seguridad los que están conectados constantemente a internet recibió más de un saludo a través de e.mail, reemplazando a las habituales tarjetas y cartas de papel que llegan por medio de el correo tradicional.|LETTER_00
652924013|la_tercera|Este es un ejemplo claro para graficar que las tradicionales cartas personales aquellas que más de una vez adquirieron ribetes míticos en la literatura clásica en boca de poetas u otro personaje legendario han ido perdiendo peso entre las costumbres de la gente, que ha optado por la ayuda de la tecnología moderna que entrega alternativas para comunicarse a distancia en forma simple y óptima.|LETTER_00
652924096|la_tercera|Actualmente, en Chile se movilizan unas 350 millones de piezas postales a el año, lo que significa un promedio cercano a las 23 cartas por persona, una cifra pequeña si se compara con otros países.|LETTER_00
652924122|la_tercera|Por ejemplo, en Canadá, cada persona recibe un promedio de 370 cartas a el año.|LETTER_00
587105813|la_tercera|Su carta de vinos consta de 14 viñas tanto emergentes como tradicionales, cuyos precios fluctúan entre los 3.100 y los 6.900.|MENU_00
587107324|la_tercera|Amplia carta de vinos a un costo promedio de 8.000 la botella.|MENU_00
798832294|mostrador|Algunas sugerencias de la carta son, en las entradas, el Pulpo a el Olivo (3.200), Ocopa Arequipeña (papas a el vapor con salsa de huacatay, maní y queso, 2.200); de fondo, Calamar a el vino tinto (reducción de vino, champiñón y calamares, 4.200), Parihuela de corvina con mariscos (sopa gruesa con cebolla, tomate, cilantro, fondo de corvina y vino blanco, 4.600), Tallarines a la peruana (filete, cebolla, tomate, cebollín, soya, jengibre, 4.400) o Seco de cordero con frejoles a el estilo peruano (4.000).|MENU_00
798832800|mostrador|El viernes 27 y el sábado 28 de el mismo mes se abrirá a todo público con la carta convencional pero con la especial misión de conducir la celebración.|MENU_00
798838565|mostrador|En igual sentido que lo referido con relación a la 'Carpeta nro.1', se observan de las cartas y notas contenidas en este legajo, la constante actividad de las personas sospechadas, siendo que unos son los operadores de las órdenes que imparten los otros, y todos ellos dentro de la escala jerárquica de la Dirección de Inteligencia Nacional de Chile (DINA), como así su continuadora, la Central Nacional de Inteligencia (CNI).|LETTER_00
798838876|mostrador|A fojas 25.27 de la misma, de fecha 09.056.78 Carta manuscrita: Estimado Luis Felipe (ARANCIBIA). Firma GEORG (WILLICKIE), la que textualmente dice 'Estimado Luis Felipe: Te doy las gracias por tu atenta carta que la recibí esta semana.|LETTER_00
799359726|mostrador|En la carta, Lupe Zevallos, hermana de el fundador de la compañía, Fernando Zevallos, expresa que 'este reinicio no debe ser transitorio, sino definitivo hasta que se produzca un fallo de el más alto nivel de el Poder Judicial chileno'.|LETTER_00
799372480|mostrador|En un contacto hecho ayer domingo con Radio Chilena, el dirigente sindical señaló que 'hemos agotados todas las instancias correspondientes. Se le mandó carta a el Presidente, a el intendente de la cuarta Región y así lo han hecho los colegas de las distintas regiones de el país. Hablamos con diputados y con el presidente de el Sistema de Administrador de Empresas (SAE), Felipe Sandoval.|LETTER_00
799380167|mostrador|González , jefe de el Ministerio Público ( MP ) , dijo que el funcionario se encontraba de vacaciones desde la semana pasada y que su carta de renuncia la recibió hoy , aunque Zeissig abandonó Guatemala ayer , domingo , rumbo a El Salvador.|LETTER_00
799403364|mostrador|En la medida que se conozcan los resultados de las demás compañías, se verá quienes jugaron bien sus cartas y quienes reprobaron la materia.|CARD_00
799404757|mostrador|De hecho , en una carta fechada el 19 de junio de este año , el Presidente Ricardo Lagos envió un saludo a la comunidad escolar por su 69 aniversario.|LETTER_00
799441385|mostrador|Aunque se ha dedicado a la fotografía publicitaria spa 'hay que vivir' y a las clases, el artista ya ha publicado un libro con una serie sobre la ex cárcel pública de Santiago titulado Despojos de sueños. 'En 1993 cuando desapareció la cárcel de Santiago, me vino la curiosidad en entrar a ella, aunque ya había ingresado alguna vez a una cárcel visitando gente, pero siempre me imaginé cómo eran estando vacías. Esa vez lo que más me robé fueron los muros escritos con la vida de los presos, sus oraciones, sus cartas, sus amores, ¡todo estaba ahí!', contó.|LETTER_00
799444029|mostrador|Las cartas señalan que tu pena va a pasar y para ello es necesario que armonices con el pasado, debes tratar de quedar en paz con todo aquello que te significó dolor.|CARD_00
799480285|mostrador|Carta enviada por Lan Chile a la Fiscalía Nacional Económica (24.07.2001) 'La Comisión Resolutiva hizo suya la proposición de Lan Chile y en estos momentos la compañía está proponiendo a la autoridad, un mecanismo que garantice el cumplimiento de la forma de operar ofrecida', dice el comunicado.|LETTER_00
799499166|mostrador|Mientras ésta se preparaba llegó a poder de Alejandro una carta de Parmenión, en la cual le aconsejaba desconfiar de Filipo, y le acusaba de estar secretamente entregada a Darío.|LETTER_00
799499208|mostrador|Alejandro, sin manifestar emoción alguna, apuró la copa de un trago, entregando simultáneamente a Filipo la carta acusatoria, cuya falsedad quedó inmediatamente demostrada.|LETTER_00
840330599|que_pasa|El ex 'carapintada' quien cumple condena perpetua por haber intentado un golpe contra el gobierno de Menem en 1990 basó sus afirmaciones en una carta de el mandatario argentino publicada por el diario inglés The Sun.|LETTER_00
840342182|que_pasa|El lunes 19, le envió una carta por fax en la que le pedía que ayudara a los senadores chilenos que iban rumbo a Londres a obtener una reunión con personeros de el más alto nivel en el gobierno de Blair.|LETTER_00
840342325|que_pasa|Una sorpresiva carta recibieron algunos colegios públicos y subvencionados de parte de el Ministerio de Educación, en la que se exigía la devolución de un texto de educación sexual que se les había hecho llegar para sus bibliotecas.|LETTER_00
840342981|que_pasa|Las declaraciones de Délano indignaron a Gómez, quien, después de defender a Frei en Valdivia, le envió una carta de rechazo y luego lo invitó a almorzar a un restaurante en Santiago, donde cordialmente se dejaron en claro que ya no eran amigos.|LETTER_00
840346314|que_pasa|Aunque el día anterior, la ex Premier de Gran Bretaña, Margaret Thatcher, había publicado una carta en el diario inglés The Times, en la cual pedía la liberación de Pinochet y reconocía el apoyo chileno en la guerra de las Malvinas, analistas bonaerenses creen que Menem no hizo referencias a el tema para no perturbar las relaciones bilaterales con Chile. 'Se trata de gestos habituales en Menem y que buscan crear un ambiente favorable para solucionar el conflicto pendiente de Campos de Hielo'.|LETTER_00
840354158|que_pasa|José Miguel Insulza v.s Gladys Marín El altercado se produjo el 14 de abril de 1998, cuando el ministro salía por la puerta principal de la Cancillería, en el preciso momento en que llegaba la dirigente comunista a entregar una carta con sus interrogantes sobre la II Cumbre de las Américas y la no invitación de Cuba a la reunión.|LETTER_00
